{
  "id": "019a2b3c-4d5e-7f00-8a00-000000000007",
  "site_id": "019a2b3c-4d5e-7f00-8a00-000000000001",
  "name": "Éjszakai kör",
  "order_mode": "fixed",
  "current_version_id": "019a2b3c-4d5e-7f00-8a00-000000000008",
  "active": true,
  "created_at": "2026-10-20T08:00:00.000Z",
  "updated_at": "2026-10-27T10:05:12.345Z"
}
